{
  "schema": "iot.device-onboarding-proposal.v1",
  "profile": {
    "schema": "iot.device-profile.authoring.v1",
    "profile": {
      "uuid": "33333333-3333-4333-8333-333333333331",
      "key": "environment_thermostat",
      "name": "Environment Sensor and Thermostat",
      "description": "Temperature and humidity telemetry with thermostat control."
    },
    "version": {
      "uuid": "33333333-3333-4333-8333-333333333332",
      "version": 1,
      "notes": "Editable AI-assisted onboarding draft.",
      "components": [
        {
          "uuid": "33333333-3333-4333-8333-333333333333",
          "key": null,
          "name": "Device",
          "description": null,
          "telemetry": [
            {
              "uuid": "33333333-3333-4333-8333-333333333334",
              "key": "temperature",
              "label": "Temperature",
              "description": "Measured ambient temperature.",
              "value_schema": {
                "data_type": "float64",
                "unit_code": "Cel",
                "required": true,
                "critical": true,
                "constraints": {"minimum": -40, "maximum": 125},
                "display": {"order": 10, "precision": 1}
              }
            },
            {
              "uuid": "33333333-3333-4333-8333-333333333335",
              "key": "humidity",
              "label": "Relative humidity",
              "description": "Measured relative humidity.",
              "value_schema": {
                "data_type": "float64",
                "unit_code": "%",
                "required": true,
                "critical": true,
                "constraints": {"minimum": 0, "maximum": 100},
                "display": {"order": 20, "precision": 1}
              }
            }
          ],
          "properties": [],
          "events": [],
          "commands": [
            {
              "uuid": "33333333-3333-4333-8333-333333333336",
              "key": "set_temperature",
              "label": "Set thermostat temperature",
              "description": "Set and confirm the thermostat target temperature.",
              "mode": "two_way",
              "risk": "medium",
              "confirmation_text": "Confirm the thermostat target temperature.",
              "timeout_seconds": 30,
              "offline_policy": "reject",
              "idempotent": true,
              "max_attempts": 3,
              "fields": [
                {
                  "uuid": "33333333-3333-4333-8333-333333333337",
                  "direction": "input",
                  "key": "temp_level",
                  "label": "Target temperature",
                  "description": "Requested thermostat temperature level.",
                  "value_schema": {
                    "data_type": "float64",
                    "unit_code": "Cel",
                    "required": true,
                    "critical": true,
                    "constraints": {"minimum": 5, "maximum": 35},
                    "display": {"order": 10, "precision": 1}
                  }
                },
                {
                  "uuid": "33333333-3333-4333-8333-333333333338",
                  "direction": "output",
                  "key": "applied_temp_level",
                  "label": "Applied temperature",
                  "description": "Temperature level reported as applied.",
                  "value_schema": {
                    "data_type": "float64",
                    "unit_code": "Cel",
                    "required": false,
                    "critical": false,
                    "constraints": {"minimum": 5, "maximum": 35},
                    "display": {"order": 10, "precision": 1}
                  }
                }
              ]
            }
          ]
        }
      ]
    }
  },
  "binding": {
    "schema": "iot.native-mqtt-binding.authoring.v1",
    "binding": {
      "uuid": "44444444-4444-4444-8444-444444444441",
      "profile_uuid": "33333333-3333-4333-8333-333333333331",
      "key": "native_mqtt_v1",
      "name": "Native MQTT firmware v1",
      "description": "Firmware-owned MQTT JSON mapping proposed by the assistant.",
      "transport": "native_mqtt_json"
    },
    "version": {
      "uuid": "44444444-4444-4444-8444-444444444442",
      "profile_version_uuid": "33333333-3333-4333-8333-333333333332",
      "version": 1,
      "notes": "Editable AI-assisted onboarding draft.",
      "channels": [
        {
          "uuid": "44444444-4444-4444-8444-444444444443",
          "key": "telemetry",
          "label": "Telemetry",
          "purpose": "telemetry",
          "direction": "device_to_platform",
          "topic_template": "devices/{device_id}/telemetry",
          "qos": 1,
          "retain": false,
          "content_type": "application/json",
          "record_path": "$",
          "max_records": 1,
          "envelope": {
            "device_id": {"scope": "payload", "json_path": "$.device_id"},
            "observed_at": {
              "path": {"scope": "payload", "json_path": "$.timestamp"},
              "format": "rfc3339"
            }
          }
        },
        {
          "uuid": "44444444-4444-4444-8444-444444444444",
          "key": "set_temperature_request",
          "label": "Set temperature request",
          "purpose": "command_request",
          "direction": "platform_to_device",
          "topic_template": "devices/{device_id}/commands/set_temperature/request",
          "qos": 1,
          "retain": false,
          "content_type": "application/json",
          "record_path": "$",
          "max_records": 1,
          "envelope": {}
        },
        {
          "uuid": "44444444-4444-4444-8444-444444444445",
          "key": "set_temperature_response",
          "label": "Set temperature response",
          "purpose": "command_response",
          "direction": "device_to_platform",
          "topic_template": "devices/{device_id}/commands/set_temperature/response",
          "qos": 1,
          "retain": false,
          "content_type": "application/json",
          "record_path": "$",
          "max_records": 1,
          "envelope": {
            "device_id": {"scope": "payload", "json_path": "$.device_id"},
            "observed_at": {
              "path": {"scope": "payload", "json_path": "$.timestamp"},
              "format": "rfc3339"
            }
          }
        }
      ],
      "telemetry_mappings": [
        {
          "uuid": "44444444-4444-4444-8444-444444444446",
          "channel": "telemetry",
          "target": "temperature",
          "source": {"scope": "record", "json_path": "$.temperature"},
          "wire_data_type": "float64",
          "missing_policy": "reject_message"
        },
        {
          "uuid": "44444444-4444-4444-8444-444444444447",
          "channel": "telemetry",
          "target": "humidity",
          "source": {"scope": "record", "json_path": "$.humidity"},
          "wire_data_type": "float64",
          "missing_policy": "reject_message"
        }
      ],
      "property_mappings": [],
      "event_mappings": [],
      "command_mappings": [
        {
          "uuid": "44444444-4444-4444-8444-444444444448",
          "target": "set_temperature",
          "request_channel": "set_temperature_request",
          "response_channel": "set_temperature_response",
          "request_template": {},
          "request_envelope": {
            "command_id_path": "$.command_id",
            "device_id_path": "$.device_id",
            "requested_at_path": "$.timestamp"
          },
          "response": {
            "correlation": {"scope": "payload", "json_path": "$.command_id"},
            "status": {
              "path": {"scope": "payload", "json_path": "$.status"},
              "values": {
                "accepted": ["accepted"],
                "running": ["running"],
                "succeeded": ["succeeded"],
                "failed": ["failed", "rejected"]
              }
            }
          },
          "field_mappings": [
            {
              "direction": "input",
              "target": "temp_level",
              "json_path": "$.temp_level",
              "wire_data_type": "float64",
              "missing_policy": "reject_message"
            },
            {
              "direction": "output",
              "target": "applied_temp_level",
              "json_path": "$.applied_temp_level",
              "wire_data_type": "float64",
              "missing_policy": "omit_value"
            }
          ]
        }
      ]
    }
  },
  "device": {
    "name": "Boiler room environment controller",
    "external_id": "sensor-001",
    "description": "Single Device draft created only after user confirmation."
  },
  "fixtures": [
    {
      "name": "temperature and humidity telemetry",
      "kind": "telemetry",
      "input": {
        "device_id": "sensor-001",
        "timestamp": "2026-08-28T18:00:00Z",
        "temperature": 22.4,
        "humidity": 47.8
      },
      "expected": {
        "device_id": "sensor-001",
        "observed_at": "2026-08-28T18:00:00Z",
        "values": {"temperature": 22.4, "humidity": 47.8}
      }
    }
  ],
  "previews": [
    {
      "name": "temperature and humidity telemetry",
      "kind": "telemetry",
      "valid": true,
      "source": {
        "device_id": "sensor-001",
        "timestamp": "2026-08-28T18:00:00Z",
        "temperature": 22.4,
        "humidity": 47.8
      },
      "canonical": {
        "device_id": "sensor-001",
        "observed_at": "2026-08-28T18:00:00Z",
        "values": {"temperature": 22.4, "humidity": 47.8}
      },
      "stages": [
        {"stage": "envelope", "status": "passed", "target": null},
        {"stage": "extraction", "status": "passed", "target": "temperature"},
        {"stage": "extraction", "status": "passed", "target": "humidity"}
      ]
    }
  ],
  "assumptions": [